{
  "id": "unt_hjnxy7sx",
  "nature": "mot",
  "langue_id": "lng_wa90y54n",
  "fait": {
    "confiance": "etablie",
    "etat_relecture": "brouillon",
    "sources": [
      {
        "source_id": "src_6zfwd3mp",
        "localisation": null
      }
    ],
    "note_interne": "À vérifier : entrée « tachycardie » du TLFi, localisation à renseigner."
  },
  "mot": {
    "categorie": "nom"
  },
  "formes": [
    {
      "id": "frm_9xpzexy8",
      "texte": "tachycardie",
      "cle_normalisee": "tachycardie",
      "systeme_ecriture_id": "ecr_ww2jr3g9",
      "role": "canonique",
      "contexte": null,
      "fait": {
        "confiance": "etablie",
        "etat_relecture": "brouillon",
        "sources": [
          {
            "source_id": "src_6zfwd3mp",
            "localisation": null
          }
        ],
        "note_interne": "À vérifier : entrée « tachycardie » du TLFi, localisation à renseigner."
      }
    }
  ],
  "sens": [
    {
      "id": "sns_1rtydqp6",
      "rang": 1,
      "libelles": {
        "fr": {
          "definition": "Accélération du rythme du cœur."
        }
      },
      "fait": {
        "confiance": "etablie",
        "etat_relecture": "brouillon",
        "sources": [
          {
            "source_id": "src_6zfwd3mp",
            "localisation": null
          }
        ],
        "note_interne": "À vérifier : entrée « tachycardie » du TLFi, localisation à renseigner."
      }
    }
  ],
  "attestation": {
    "id": "att_bmjhr8fw",
    "annee": 1871,
    "precision": "annee",
    "fait": {
      "confiance": "etablie",
      "etat_relecture": "brouillon",
      "sources": [
        {
          "source_id": "src_6zfwd3mp",
          "localisation": "entrée « tachycardie »"
        }
      ],
      "note_interne": "Date relue dans la rubrique « Étymologie et histoire » de l’entrée « tachycardie » du TLFi (cnrtl.fr), le 9 octobre 2026."
    }
  }
}
