{
  "id": "unt_ccef2cq5",
  "nature": "mot",
  "langue_id": "lng_wa90y54n",
  "fait": {
    "confiance": "etablie",
    "etat_relecture": "brouillon",
    "sources": [],
    "note_interne": "À vérifier : entrée « hématophobie » du TLFi, localisation à renseigner. Wikidata ne porte pas ce fait (consulté le 10 octobre 2026, ADR 0060) : aucun lexème « hématophobie » (Q150) trouvé par lemme exact. Non publiable tant que Wikidata ne le porte pas."
  },
  "mot": {
    "categorie": "nom"
  },
  "formes": [
    {
      "id": "frm_mv96s7pr",
      "texte": "hématophobie",
      "cle_normalisee": "hématophobie",
      "systeme_ecriture_id": "ecr_ww2jr3g9",
      "role": "canonique",
      "contexte": null,
      "fait": {
        "confiance": "etablie",
        "etat_relecture": "brouillon",
        "sources": [],
        "note_interne": "À vérifier : entrée « hématophobie » du TLFi, localisation à renseigner. Wikidata ne porte pas ce fait (consulté le 10 octobre 2026, ADR 0060) : aucun lexème « hématophobie » (Q150) trouvé par lemme exact. Non publiable tant que Wikidata ne le porte pas."
      }
    }
  ],
  "sens": [
    {
      "id": "sns_5pza355s",
      "rang": 1,
      "libelles": {
        "fr": {
          "definition": "Peur du sang."
        }
      },
      "fait": {
        "confiance": "etablie",
        "etat_relecture": "brouillon",
        "sources": [],
        "note_interne": "À vérifier : entrée « hématophobie » du TLFi, localisation à renseigner. Wikidata ne porte pas ce fait (consulté le 10 octobre 2026, ADR 0060) : aucun lexème « hématophobie » (Q150) trouvé par lemme exact. Non publiable tant que Wikidata ne le porte pas."
      }
    }
  ]
}
