{
  "id": "unt_yvjw3p2j",
  "nature": "mot",
  "langue_id": "lng_wa90y54n",
  "fait": {
    "confiance": "etablie",
    "etat_relecture": "brouillon",
    "sources": [],
    "note_interne": "À vérifier : entrée « aérophagie » du TLFi, localisation à renseigner. Wikidata ne porte pas ce fait (consulté le 10 octobre 2026, ADR 0060) : aucun lexème « aérophagie » (Q150) trouvé par lemme exact. Non publiable tant que Wikidata ne le porte pas."
  },
  "mot": {
    "categorie": "nom"
  },
  "formes": [
    {
      "id": "frm_ccca2gkm",
      "texte": "aérophagie",
      "cle_normalisee": "aérophagie",
      "systeme_ecriture_id": "ecr_ww2jr3g9",
      "role": "canonique",
      "contexte": null,
      "fait": {
        "confiance": "etablie",
        "etat_relecture": "brouillon",
        "sources": [],
        "note_interne": "À vérifier : entrée « aérophagie » du TLFi, localisation à renseigner. Wikidata ne porte pas ce fait (consulté le 10 octobre 2026, ADR 0060) : aucun lexème « aérophagie » (Q150) trouvé par lemme exact. Non publiable tant que Wikidata ne le porte pas."
      }
    }
  ],
  "sens": [
    {
      "id": "sns_0s2g5kt7",
      "rang": 1,
      "libelles": {
        "fr": {
          "definition": "Fait d’avaler de l’air, ce qui gonfle l’estomac."
        }
      },
      "fait": {
        "confiance": "etablie",
        "etat_relecture": "brouillon",
        "sources": [],
        "note_interne": "À vérifier : entrée « aérophagie » du TLFi, localisation à renseigner. Wikidata ne porte pas ce fait (consulté le 10 octobre 2026, ADR 0060) : aucun lexème « aérophagie » (Q150) trouvé par lemme exact. Non publiable tant que Wikidata ne le porte pas."
      }
    }
  ]
}
