{
  "id": "unt_4pj0jxfp",
  "nature": "mot",
  "langue_id": "lng_kmf44d76",
  "fait": {
    "confiance": "etablie",
    "etat_relecture": "brouillon",
    "sources": [
      {
        "source_id": "src_1g2et8hj",
        "localisation": null
      }
    ],
    "note_interne": "À vérifier : entrée « δῆμος » du Bailly, localisation à renseigner."
  },
  "mot": {
    "categorie": "nom"
  },
  "formes": [
    {
      "id": "frm_91m40z7e",
      "texte": "δῆμος",
      "cle_normalisee": "δῆμος",
      "systeme_ecriture_id": "ecr_m63cytfk",
      "role": "canonique",
      "contexte": null,
      "translitterations": [
        {
          "convention_id": "cnv_570ncjj6",
          "texte": "dêmos"
        }
      ],
      "fait": {
        "confiance": "etablie",
        "etat_relecture": "brouillon",
        "sources": [
          {
            "source_id": "src_1g2et8hj",
            "localisation": null
          }
        ],
        "note_interne": "À vérifier : entrée « δῆμος » du Bailly, localisation à renseigner."
      }
    }
  ],
  "sens": [
    {
      "id": "sns_08teh195",
      "rang": 1,
      "libelles": {
        "fr": {
          "glose": "peuple"
        }
      },
      "fait": {
        "confiance": "etablie",
        "etat_relecture": "brouillon",
        "sources": [
          {
            "source_id": "src_1g2et8hj",
            "localisation": null
          }
        ],
        "note_interne": "À vérifier : entrée « δῆμος » du Bailly, localisation à renseigner."
      }
    }
  ]
}
