{
  "id": "unt_nvp2bfwc",
  "nature": "mot",
  "langue_id": "lng_wa90y54n",
  "fait": {
    "confiance": "etablie",
    "etat_relecture": "relu",
    "sources": [
      {
        "source_id": "src_6zfwd3mp",
        "localisation": "entrée « anthropographie »"
      }
    ],
    "note_interne": "À vérifier : entrée « anthropographie » peut-être absente du TLFi ; attestée au Littré (source à créer), localisation à confirmer."
  },
  "mot": {
    "categorie": "nom"
  },
  "formes": [
    {
      "id": "frm_9qpny16k",
      "texte": "anthropographie",
      "cle_normalisee": "anthropographie",
      "systeme_ecriture_id": "ecr_ww2jr3g9",
      "role": "canonique",
      "contexte": null,
      "fait": {
        "confiance": "etablie",
        "etat_relecture": "relu",
        "sources": [
          {
            "source_id": "src_6zfwd3mp",
            "localisation": "entrée « anthropographie »"
          }
        ],
        "note_interne": "À vérifier : entrée « anthropographie » peut-être absente du TLFi ; attestée au Littré (source à créer), localisation à confirmer."
      }
    }
  ],
  "sens": [
    {
      "id": "sns_24x8kwhn",
      "rang": 1,
      "libelles": {
        "fr": {
          "definition": "Description de l’être humain, considéré comme une espèce parmi les animaux."
        }
      },
      "fait": {
        "confiance": "etablie",
        "etat_relecture": "relu",
        "sources": [
          {
            "source_id": "src_6zfwd3mp",
            "localisation": "entrée « anthropographie »"
          }
        ],
        "note_interne": "À vérifier : entrée « anthropographie » peut-être absente du TLFi ; attestée au Littré (source à créer), localisation à confirmer."
      }
    }
  ]
}
