{
  "id": "unt_w3vqxstb",
  "nature": "mot",
  "langue_id": "lng_wa90y54n",
  "fait": {
    "confiance": "probable",
    "etat_relecture": "relu",
    "sources": [
      {
        "source_id": "src_tyvnmjjn",
        "localisation": "L1583631, consulté le 10 octobre 2026"
      }
    ],
    "note_interne": "À vérifier : entrée « photobiologie » du TLFi, localisation à confirmer. Recoupé avec Wikidata le 10 octobre 2026 (ADR 0060). Repassé en brouillon : la relecture humaine doit rejouer la requête."
  },
  "mot": {
    "categorie": "nom"
  },
  "formes": [
    {
      "id": "frm_erp66t24",
      "texte": "photobiologie",
      "cle_normalisee": "photobiologie",
      "systeme_ecriture_id": "ecr_ww2jr3g9",
      "role": "canonique",
      "contexte": null,
      "fait": {
        "confiance": "probable",
        "etat_relecture": "relu",
        "sources": [
          {
            "source_id": "src_tyvnmjjn",
            "localisation": "L1583631, consulté le 10 octobre 2026"
          }
        ],
        "note_interne": "À vérifier : entrée « photobiologie » du TLFi, localisation à confirmer. Recoupé avec Wikidata le 10 octobre 2026 (ADR 0060). Repassé en brouillon : la relecture humaine doit rejouer la requête."
      }
    }
  ],
  "sens": [
    {
      "id": "sns_9913d25a",
      "rang": 1,
      "libelles": {
        "fr": {
          "definition": "Étude des effets de la lumière sur les êtres vivants."
        }
      },
      "fait": {
        "confiance": "probable",
        "etat_relecture": "relu",
        "sources": [
          {
            "source_id": "src_tyvnmjjn",
            "localisation": "L1583631-S1, consulté le 10 octobre 2026"
          }
        ],
        "note_interne": "À vérifier : entrée « photobiologie » du TLFi, localisation à confirmer. Recoupé avec Wikidata le 10 octobre 2026 (ADR 0060). Glose comparée au sens Wikidata le 10 octobre 2026 : concordante. Repassé en brouillon : la relecture humaine doit rejouer la requête."
      }
    }
  ]
}
