{
  "id": "unt_te1rew0t",
  "nature": "prefixe",
  "langue_id": "lng_wa90y54n",
  "fait": {
    "confiance": "probable",
    "etat_relecture": "relu",
    "sources": [
      {
        "source_id": "src_tyvnmjjn",
        "localisation": "L20363, consulté le 10 octobre 2026"
      }
    ],
    "note_interne": "À vérifier : entrée « déci » du TLFi, localisation à renseigner. Recoupé avec Wikidata le 10 octobre 2026 (ADR 0060)."
  },
  "affixe": {
    "statut": "element_de_composition"
  },
  "formes": [
    {
      "id": "frm_fd32mpkg",
      "texte": "déci",
      "cle_normalisee": "déci",
      "systeme_ecriture_id": "ecr_ww2jr3g9",
      "role": "canonique",
      "contexte": null,
      "fait": {
        "confiance": "probable",
        "etat_relecture": "relu",
        "sources": [
          {
            "source_id": "src_tyvnmjjn",
            "localisation": "L20363, consulté le 10 octobre 2026"
          }
        ],
        "note_interne": "À vérifier : entrée « déci » du TLFi, localisation à renseigner. Recoupé avec Wikidata le 10 octobre 2026 (ADR 0060)."
      }
    }
  ],
  "sens": [
    {
      "id": "sns_m4bzgevp",
      "rang": 1,
      "libelles": {
        "fr": {
          "glose": "dixième"
        }
      },
      "fait": {
        "confiance": "probable",
        "etat_relecture": "relu",
        "sources": [
          {
            "source_id": "src_tyvnmjjn",
            "localisation": "L20363-S1, consulté le 10 octobre 2026"
          }
        ],
        "note_interne": "À vérifier : entrée « déci » du TLFi, localisation à renseigner. Recoupé avec Wikidata le 10 octobre 2026 (ADR 0060). Glose comparée au sens Wikidata le 10 octobre 2026 : concordante."
      }
    }
  ]
}
