{
  "id": "unt_2e7dkffd",
  "nature": "mot",
  "langue_id": "lng_wa90y54n",
  "fait": {
    "confiance": "etablie",
    "etat_relecture": "brouillon",
    "sources": [
      {
        "source_id": "src_6zfwd3mp",
        "localisation": null
      }
    ],
    "note_interne": "À vérifier : entrée « diaphone » du TLFi, localisation à renseigner."
  },
  "mot": {
    "categorie": "nom"
  },
  "formes": [
    {
      "id": "frm_m5b0zym4",
      "texte": "diaphone",
      "cle_normalisee": "diaphone",
      "systeme_ecriture_id": "ecr_ww2jr3g9",
      "role": "canonique",
      "contexte": null,
      "fait": {
        "confiance": "etablie",
        "etat_relecture": "brouillon",
        "sources": [
          {
            "source_id": "src_6zfwd3mp",
            "localisation": null
          }
        ],
        "note_interne": "À vérifier : entrée « diaphone » du TLFi, localisation à renseigner."
      }
    }
  ],
  "sens": [
    {
      "id": "sns_2x55wjnq",
      "rang": 1,
      "libelles": {
        "fr": {
          "definition": "Signal sonore de brume à air comprimé."
        }
      },
      "fait": {
        "confiance": "etablie",
        "etat_relecture": "brouillon",
        "sources": [
          {
            "source_id": "src_6zfwd3mp",
            "localisation": null
          }
        ],
        "note_interne": "À vérifier : entrée « diaphone » du TLFi, localisation à renseigner."
      }
    }
  ]
}
