{
  "id": "unt_agp7mmja",
  "nature": "mot",
  "langue_id": "lng_wa90y54n",
  "fait": {
    "confiance": "etablie",
    "etat_relecture": "relu",
    "sources": [],
    "note_interne": "À vérifier : entrée « thermologie » du TLFi, localisation à renseigner. Wikidata ne porte pas ce fait (consulté le 10 octobre 2026, ADR 0060) : aucun lexème « thermologie » (Q150) trouvé par lemme exact. Non publiable tant que Wikidata ne le porte pas."
  },
  "mot": {
    "categorie": "nom"
  },
  "formes": [
    {
      "id": "frm_2bwwr443",
      "texte": "thermologie",
      "cle_normalisee": "thermologie",
      "systeme_ecriture_id": "ecr_ww2jr3g9",
      "role": "canonique",
      "contexte": null,
      "fait": {
        "confiance": "etablie",
        "etat_relecture": "relu",
        "sources": [],
        "note_interne": "À vérifier : entrée « thermologie » du TLFi, localisation à renseigner. Wikidata ne porte pas ce fait (consulté le 10 octobre 2026, ADR 0060) : aucun lexème « thermologie » (Q150) trouvé par lemme exact. Non publiable tant que Wikidata ne le porte pas."
      }
    }
  ],
  "sens": [
    {
      "id": "sns_xbb7x5mr",
      "rang": 1,
      "libelles": {
        "fr": {
          "definition": "Étude de la chaleur ; en médecine, mesure de la température du corps."
        }
      },
      "fait": {
        "confiance": "etablie",
        "etat_relecture": "relu",
        "sources": [],
        "note_interne": "À vérifier : entrée « thermologie » du TLFi, localisation à renseigner. Wikidata ne porte pas ce fait (consulté le 10 octobre 2026, ADR 0060) : aucun lexème « thermologie » (Q150) trouvé par lemme exact. Non publiable tant que Wikidata ne le porte pas."
      }
    }
  ]
}
