{
  "id": "unt_3f0st1ty",
  "nature": "mot",
  "langue_id": "lng_wa90y54n",
  "fait": {
    "confiance": "etablie",
    "etat_relecture": "relu",
    "sources": [
      {
        "source_id": "src_6zfwd3mp",
        "localisation": "entrée « calligraphe »"
      }
    ],
    "note_interne": "À vérifier : entrée « calligraphe » du TLFi, localisation à confirmer."
  },
  "mot": {
    "categorie": "nom"
  },
  "formes": [
    {
      "id": "frm_vdy2d8cd",
      "texte": "calligraphe",
      "cle_normalisee": "calligraphe",
      "systeme_ecriture_id": "ecr_ww2jr3g9",
      "role": "canonique",
      "contexte": null,
      "fait": {
        "confiance": "etablie",
        "etat_relecture": "relu",
        "sources": [
          {
            "source_id": "src_6zfwd3mp",
            "localisation": "entrée « calligraphe »"
          }
        ],
        "note_interne": "À vérifier : entrée « calligraphe » du TLFi, localisation à confirmer."
      }
    }
  ],
  "sens": [
    {
      "id": "sns_eqrrh0m9",
      "rang": 1,
      "libelles": {
        "fr": {
          "definition": "Personne qui pratique la calligraphie."
        }
      },
      "fait": {
        "confiance": "etablie",
        "etat_relecture": "relu",
        "sources": [
          {
            "source_id": "src_6zfwd3mp",
            "localisation": "entrée « calligraphe »"
          }
        ],
        "note_interne": "À vérifier : entrée « calligraphe » du TLFi, localisation à confirmer."
      }
    }
  ],
  "attestation": {
    "id": "att_0jstnemy",
    "annee": 1751,
    "precision": "annee",
    "fait": {
      "confiance": "etablie",
      "etat_relecture": "brouillon",
      "sources": [
        {
          "source_id": "src_6zfwd3mp",
          "localisation": "entrée « calligraphe »"
        }
      ],
      "note_interne": "Date relue dans la rubrique « Étymologie et histoire » de l’entrée « calligraphe » du TLFi (cnrtl.fr), le 9 octobre 2026."
    }
  }
}
