{
  "id": "unt_8gf8fnn5",
  "nature": "prefixe",
  "langue_id": "lng_wa90y54n",
  "fait": {
    "confiance": "etablie",
    "etat_relecture": "relu",
    "sources": [],
    "note_interne": "À vérifier : entrée « ostéo » du TLFi, localisation à renseigner. Wikidata ne porte pas ce fait (consulté le 10 octobre 2026, ADR 0060) : aucun lexème « ostéo » (Q150) trouvé par lemme exact. Non publiable tant que Wikidata ne le porte pas."
  },
  "affixe": {
    "statut": "element_de_composition"
  },
  "formes": [
    {
      "id": "frm_a4cr6wdt",
      "texte": "ostéo",
      "cle_normalisee": "ostéo",
      "systeme_ecriture_id": "ecr_ww2jr3g9",
      "role": "canonique",
      "contexte": null,
      "fait": {
        "confiance": "etablie",
        "etat_relecture": "relu",
        "sources": [],
        "note_interne": "À vérifier : entrée « ostéo » du TLFi, localisation à renseigner. Wikidata ne porte pas ce fait (consulté le 10 octobre 2026, ADR 0060) : aucun lexème « ostéo » (Q150) trouvé par lemme exact. Non publiable tant que Wikidata ne le porte pas."
      }
    }
  ],
  "sens": [
    {
      "id": "sns_vvc1n6ye",
      "rang": 1,
      "libelles": {
        "fr": {
          "glose": "os"
        }
      },
      "fait": {
        "confiance": "etablie",
        "etat_relecture": "relu",
        "sources": [],
        "note_interne": "À vérifier : entrée « ostéo » du TLFi, localisation à renseigner. Wikidata ne porte pas ce fait (consulté le 10 octobre 2026, ADR 0060) : aucun lexème « ostéo » (Q150) trouvé par lemme exact. Non publiable tant que Wikidata ne le porte pas."
      }
    }
  ]
}
