{
  "id": "unt_eytx6dq5",
  "nature": "mot",
  "langue_id": "lng_wa90y54n",
  "fait": {
    "confiance": "probable",
    "etat_relecture": "brouillon",
    "sources": [
      {
        "source_id": "src_tyvnmjjn",
        "localisation": "L26549, consulté le 10 octobre 2026"
      }
    ],
    "note_interne": "À vérifier : entrée « psychologique » du TLFi, localisation à renseigner. Recoupé avec Wikidata le 10 octobre 2026 (ADR 0060)."
  },
  "mot": {
    "categorie": "adjectif"
  },
  "formes": [
    {
      "id": "frm_qmwe65bw",
      "texte": "psychologique",
      "cle_normalisee": "psychologique",
      "systeme_ecriture_id": "ecr_ww2jr3g9",
      "role": "canonique",
      "contexte": null,
      "fait": {
        "confiance": "probable",
        "etat_relecture": "brouillon",
        "sources": [
          {
            "source_id": "src_tyvnmjjn",
            "localisation": "L26549, consulté le 10 octobre 2026"
          }
        ],
        "note_interne": "À vérifier : entrée « psychologique » du TLFi, localisation à renseigner. Recoupé avec Wikidata le 10 octobre 2026 (ADR 0060)."
      }
    }
  ],
  "sens": [
    {
      "id": "sns_akkenwy5",
      "rang": 1,
      "libelles": {
        "fr": {
          "definition": "Relatif à la psychologie ; qui convient au moment."
        }
      },
      "fait": {
        "confiance": "probable",
        "etat_relecture": "brouillon",
        "sources": [
          {
            "source_id": "src_tyvnmjjn",
            "localisation": "L26549-S1, consulté le 10 octobre 2026"
          }
        ],
        "note_interne": "À vérifier : entrée « psychologique » du TLFi, localisation à renseigner. Recoupé avec Wikidata le 10 octobre 2026 (ADR 0060). Glose comparée au sens Wikidata le 10 octobre 2026 : concordante."
      }
    }
  ]
}
