{
  "id": "unt_vvm4ndv2",
  "nature": "mot",
  "langue_id": "lng_wa90y54n",
  "fait": {
    "confiance": "etablie",
    "etat_relecture": "brouillon",
    "sources": [
      {
        "source_id": "src_6zfwd3mp",
        "localisation": null
      }
    ],
    "note_interne": "À vérifier : entrée « sténotypie » du TLFi, localisation à renseigner."
  },
  "mot": {
    "categorie": "nom"
  },
  "formes": [
    {
      "id": "frm_hbdnh59n",
      "texte": "sténotypie",
      "cle_normalisee": "sténotypie",
      "systeme_ecriture_id": "ecr_ww2jr3g9",
      "role": "canonique",
      "contexte": null,
      "fait": {
        "confiance": "etablie",
        "etat_relecture": "brouillon",
        "sources": [
          {
            "source_id": "src_6zfwd3mp",
            "localisation": null
          }
        ],
        "note_interne": "À vérifier : entrée « sténotypie » du TLFi, localisation à renseigner."
      }
    }
  ],
  "sens": [
    {
      "id": "sns_5w4kkq0f",
      "rang": 1,
      "libelles": {
        "fr": {
          "definition": "Sténographie à la machine."
        }
      },
      "fait": {
        "confiance": "etablie",
        "etat_relecture": "brouillon",
        "sources": [
          {
            "source_id": "src_6zfwd3mp",
            "localisation": null
          }
        ],
        "note_interne": "À vérifier : entrée « sténotypie » du TLFi, localisation à renseigner."
      }
    }
  ],
  "attestation": {
    "id": "att_xk2tkrpk",
    "annee": 1864,
    "precision": "annee",
    "fait": {
      "confiance": "etablie",
      "etat_relecture": "brouillon",
      "sources": [
        {
          "source_id": "src_6zfwd3mp",
          "localisation": "entrée « sténotypie »"
        }
      ],
      "note_interne": "Date relue dans la rubrique « Étymologie et histoire » de l’entrée « sténotypie » du TLFi (cnrtl.fr), le 9 octobre 2026."
    }
  }
}
