{
  "id": "unt_bfbdrfw3",
  "nature": "mot",
  "langue_id": "lng_wa90y54n",
  "fait": {
    "confiance": "probable",
    "etat_relecture": "brouillon",
    "sources": [
      {
        "source_id": "src_tyvnmjjn",
        "localisation": "L24143, consulté le 10 octobre 2026"
      }
    ],
    "note_interne": "À vérifier : entrée « calligraphie » du TLFi, localisation à confirmer. Recoupé avec Wikidata le 10 octobre 2026 (ADR 0060). Repassé en brouillon : la relecture humaine doit rejouer la requête."
  },
  "mot": {
    "categorie": "nom"
  },
  "formes": [
    {
      "id": "frm_h49ce0r4",
      "texte": "calligraphie",
      "cle_normalisee": "calligraphie",
      "systeme_ecriture_id": "ecr_ww2jr3g9",
      "role": "canonique",
      "contexte": null,
      "fait": {
        "confiance": "probable",
        "etat_relecture": "brouillon",
        "sources": [
          {
            "source_id": "src_tyvnmjjn",
            "localisation": "L24143, consulté le 10 octobre 2026"
          }
        ],
        "note_interne": "À vérifier : entrée « calligraphie » du TLFi, localisation à confirmer. Recoupé avec Wikidata le 10 octobre 2026 (ADR 0060). Repassé en brouillon : la relecture humaine doit rejouer la requête."
      }
    }
  ],
  "sens": [
    {
      "id": "sns_68tqeng7",
      "rang": 1,
      "libelles": {
        "fr": {
          "glose": "belle écriture",
          "definition": "Art de tracer à la main des lettres belles et régulières."
        }
      },
      "fait": {
        "confiance": "probable",
        "etat_relecture": "brouillon",
        "sources": [
          {
            "source_id": "src_tyvnmjjn",
            "localisation": "L24143-S1, consulté le 10 octobre 2026"
          }
        ],
        "note_interne": "À vérifier : entrée « calligraphie » du TLFi, localisation à confirmer. Recoupé avec Wikidata le 10 octobre 2026 (ADR 0060). Glose comparée au sens Wikidata le 10 octobre 2026 : concordante. Repassé en brouillon : la relecture humaine doit rejouer la requête."
      }
    }
  ]
}
