{
  "id": "unt_8kww3p6h",
  "nature": "mot",
  "langue_id": "lng_c5sy8ve2",
  "fait": {
    "confiance": "probable",
    "etat_relecture": "brouillon",
    "sources": [
      {
        "source_id": "src_tyvnmjjn",
        "localisation": "L1054295 ou L276077, consulté le 10 octobre 2026"
      }
    ],
    "note_interne": "À vérifier : entrée « inde » du Gaffiot, localisation à confirmer. Recoupé avec Wikidata le 10 octobre 2026 (ADR 0060). Repassé en brouillon : la relecture humaine doit rejouer la requête."
  },
  "mot": {
    "categorie": "adverbe"
  },
  "formes": [
    {
      "id": "frm_jwfxgfrk",
      "texte": "inde",
      "cle_normalisee": "inde",
      "systeme_ecriture_id": "ecr_ww2jr3g9",
      "role": "canonique",
      "contexte": null,
      "fait": {
        "confiance": "probable",
        "etat_relecture": "brouillon",
        "sources": [
          {
            "source_id": "src_tyvnmjjn",
            "localisation": "L1054295 ou L276077, consulté le 10 octobre 2026"
          }
        ],
        "note_interne": "À vérifier : entrée « inde » du Gaffiot, localisation à confirmer. Recoupé avec Wikidata le 10 octobre 2026 (ADR 0060). Repassé en brouillon : la relecture humaine doit rejouer la requête."
      }
    }
  ],
  "sens": [
    {
      "id": "sns_gyksdbbs",
      "rang": 1,
      "libelles": {
        "fr": {
          "glose": "de là"
        }
      },
      "fait": {
        "confiance": "probable",
        "etat_relecture": "brouillon",
        "sources": [
          {
            "source_id": "src_tyvnmjjn",
            "localisation": "L1054295 ou L276077, consulté le 10 octobre 2026"
          }
        ],
        "note_interne": "À vérifier : entrée « inde » du Gaffiot, localisation à confirmer. Recoupé avec Wikidata le 10 octobre 2026 (ADR 0060). Le lexème ne détaille pas ses sens : glose à vérifier en relecture. Repassé en brouillon : la relecture humaine doit rejouer la requête."
      }
    }
  ]
}
