{
  "id": "unt_qdj224yt",
  "nature": "mot",
  "langue_id": "lng_wa90y54n",
  "fait": {
    "confiance": "etablie",
    "etat_relecture": "brouillon",
    "sources": [
      {
        "source_id": "src_6zfwd3mp",
        "localisation": "entrée « télépathie »"
      }
    ],
    "note_interne": "À vérifier : entrée « télépathie » du TLFi, localisation à confirmer."
  },
  "mot": {
    "categorie": "nom"
  },
  "formes": [
    {
      "id": "frm_4eg52f9k",
      "texte": "télépathie",
      "cle_normalisee": "télépathie",
      "systeme_ecriture_id": "ecr_ww2jr3g9",
      "role": "canonique",
      "contexte": null,
      "fait": {
        "confiance": "etablie",
        "etat_relecture": "brouillon",
        "sources": [
          {
            "source_id": "src_6zfwd3mp",
            "localisation": "entrée « télépathie »"
          }
        ],
        "note_interne": "À vérifier : entrée « télépathie » du TLFi, localisation à confirmer."
      }
    }
  ],
  "sens": [
    {
      "id": "sns_31aeq2nz",
      "rang": 1,
      "libelles": {
        "fr": {
          "definition": "Communication supposée entre esprits, sans passer par les sens."
        }
      },
      "fait": {
        "confiance": "etablie",
        "etat_relecture": "brouillon",
        "sources": [
          {
            "source_id": "src_6zfwd3mp",
            "localisation": "entrée « télépathie »"
          }
        ],
        "note_interne": "À vérifier : entrée « télépathie » du TLFi, localisation à confirmer."
      }
    }
  ]
}
