{
  "id": "unt_nj009kmq",
  "nature": "mot",
  "langue_id": "lng_wa90y54n",
  "fait": {
    "confiance": "probable",
    "etat_relecture": "relu",
    "sources": [
      {
        "source_id": "src_tyvnmjjn",
        "localisation": "L1584086, consulté le 10 octobre 2026"
      }
    ],
    "note_interne": "À vérifier : entrée « cosmographie » du TLFi, localisation à renseigner. Recoupé avec Wikidata le 10 octobre 2026 (ADR 0060)."
  },
  "mot": {
    "categorie": "nom"
  },
  "formes": [
    {
      "id": "frm_rtsv1qy1",
      "texte": "cosmographie",
      "cle_normalisee": "cosmographie",
      "systeme_ecriture_id": "ecr_ww2jr3g9",
      "role": "canonique",
      "contexte": null,
      "fait": {
        "confiance": "probable",
        "etat_relecture": "relu",
        "sources": [
          {
            "source_id": "src_tyvnmjjn",
            "localisation": "L1584086, consulté le 10 octobre 2026"
          }
        ],
        "note_interne": "À vérifier : entrée « cosmographie » du TLFi, localisation à renseigner. Recoupé avec Wikidata le 10 octobre 2026 (ADR 0060)."
      }
    }
  ],
  "sens": [
    {
      "id": "sns_y66h294p",
      "rang": 1,
      "libelles": {
        "fr": {
          "definition": "Description de l’univers et des astres."
        }
      },
      "fait": {
        "confiance": "probable",
        "etat_relecture": "relu",
        "sources": [
          {
            "source_id": "src_tyvnmjjn",
            "localisation": "L1584086-S1, consulté le 10 octobre 2026"
          }
        ],
        "note_interne": "À vérifier : entrée « cosmographie » du TLFi, localisation à renseigner. Recoupé avec Wikidata le 10 octobre 2026 (ADR 0060). Glose comparée au sens Wikidata le 10 octobre 2026 : concordante."
      }
    }
  ]
}
