{
  "id": "unt_ny8zhzf7",
  "nature": "prefixe",
  "langue_id": "lng_wa90y54n",
  "fait": {
    "confiance": "etablie",
    "etat_relecture": "brouillon",
    "sources": [],
    "note_interne": "À vérifier : entrée « pan » du TLFi, localisation à renseigner. Wikidata ne porte pas ce fait (consulté le 10 octobre 2026, ADR 0060) : aucun lexème « pan » (Q150) trouvé par lemme exact. Non publiable tant que Wikidata ne le porte pas."
  },
  "affixe": {
    "statut": "element_de_composition"
  },
  "formes": [
    {
      "id": "frm_wesjtxkb",
      "texte": "pan",
      "cle_normalisee": "pan",
      "systeme_ecriture_id": "ecr_ww2jr3g9",
      "role": "canonique",
      "contexte": null,
      "fait": {
        "confiance": "etablie",
        "etat_relecture": "brouillon",
        "sources": [],
        "note_interne": "À vérifier : entrée « pan » du TLFi, localisation à renseigner. Wikidata ne porte pas ce fait (consulté le 10 octobre 2026, ADR 0060) : aucun lexème « pan » (Q150) trouvé par lemme exact. Non publiable tant que Wikidata ne le porte pas."
      }
    }
  ],
  "sens": [
    {
      "id": "sns_xgnmvq73",
      "rang": 1,
      "libelles": {
        "fr": {
          "glose": "tout"
        }
      },
      "fait": {
        "confiance": "etablie",
        "etat_relecture": "brouillon",
        "sources": [],
        "note_interne": "À vérifier : entrée « pan » du TLFi, localisation à renseigner. Wikidata ne porte pas ce fait (consulté le 10 octobre 2026, ADR 0060) : aucun lexème « pan » (Q150) trouvé par lemme exact. Non publiable tant que Wikidata ne le porte pas."
      }
    }
  ]
}
