{
  "id": "unt_efayj8wt",
  "nature": "mot",
  "langue_id": "lng_wa90y54n",
  "fait": {
    "confiance": "probable",
    "etat_relecture": "brouillon",
    "sources": [
      {
        "source_id": "src_tyvnmjjn",
        "localisation": "L1583370, consulté le 10 octobre 2026"
      }
    ],
    "note_interne": "À vérifier : entrée « phoniatrie » du TLFi, localisation à renseigner. Recoupé avec Wikidata le 10 octobre 2026 (ADR 0060)."
  },
  "mot": {
    "categorie": "nom"
  },
  "formes": [
    {
      "id": "frm_et9hxnkt",
      "texte": "phoniatrie",
      "cle_normalisee": "phoniatrie",
      "systeme_ecriture_id": "ecr_ww2jr3g9",
      "role": "canonique",
      "contexte": null,
      "fait": {
        "confiance": "probable",
        "etat_relecture": "brouillon",
        "sources": [
          {
            "source_id": "src_tyvnmjjn",
            "localisation": "L1583370, consulté le 10 octobre 2026"
          }
        ],
        "note_interne": "À vérifier : entrée « phoniatrie » du TLFi, localisation à renseigner. Recoupé avec Wikidata le 10 octobre 2026 (ADR 0060)."
      }
    }
  ],
  "sens": [
    {
      "id": "sns_mqxgf7wx",
      "rang": 1,
      "libelles": {
        "fr": {
          "definition": "Branche de la médecine qui soigne les troubles de la voix."
        }
      },
      "fait": {
        "confiance": "probable",
        "etat_relecture": "brouillon",
        "sources": [
          {
            "source_id": "src_tyvnmjjn",
            "localisation": "L1583370-S1, consulté le 10 octobre 2026"
          }
        ],
        "note_interne": "À vérifier : entrée « phoniatrie » du TLFi, localisation à renseigner. Recoupé avec Wikidata le 10 octobre 2026 (ADR 0060). Glose comparée au sens Wikidata le 10 octobre 2026 : concordante."
      }
    }
  ]
}
